{
  "$schema": "./config.schema.json",
  "allowedLicenses": [
    "MIT",
    "Apache-2.0",
    "BSD-2-Clause",
    "BSD-3-Clause",
    "ISC",
    "0BSD",
    "BlueOak-1.0.0",
    "CC0-1.0",
    "CC-BY-4.0",
    "Unlicense",
    "Python-2.0",
    "Artistic-2.0",
    "Zlib",
    "MPL-2.0",
    "OFL-1.1",
    "SIL OPEN FONT LICENSE",
    "MIT-0"
  ],
  "reviewRequired": [
    "LGPL-2.0",
    "LGPL-2.1",
    "LGPL-3.0",
    "LGPL-3.0-or-later",
    "EPL-1.0",
    "EPL-2.0",
    "CDDL-1.0",
    "CDDL-1.1"
  ],
  "forbidden": ["GPL-2.0", "GPL-3.0", "AGPL-3.0", "SSPL-1.0", "BUSL-1.1"],
  "ignoreDev": false,
  "ignorePackages": [],
  "overrides": {}
}
